{
  "kicker": "문서 구성",
  "title": "목차",
  "items": [
    { "no": "1.", "group": "기본 이해", "text": "플랫폼 개요", "note": "도입 목적과 배경", "page": "3" },
    { "no": "2.", "group": "기본 이해", "text": "3계층 시스템 구조", "note": "백엔드·프론트·DB", "page": "5" },
    { "no": "3.", "group": "운영 흐름", "text": "보고서 워크플로", "note": "작성→게시→종합", "page": "8" },
    { "no": "4.", "group": "운영 흐름", "text": "보고서 관계 3종", "note": "Mount / Fork 비교", "page": "11" },
    { "no": "5.", "group": "작성 기능", "text": "위젯 카탈로그 35종", "note": "표·차트·관계도", "page": "14" },
    { "no": "6.", "group": "작성 기능", "text": "혼동하기 쉬운 위젯 쌍", "note": "선택 가이드", "page": "17" },
    { "no": "7.", "group": "운영 정책", "text": "권한·역할 모델", "note": "RACI·편집 정책", "page": "19" },
    { "no": "8.", "group": "운영 정책", "text": "배포와 향후 계획", "note": "SIF 단일 이미지", "page": "23" }
  ],
  "note": "페이지 번호는 인쇄본 기준이며 화면본과 다를 수 있다",
  "page": { "no": "2", "total": "28" },
  "footer": { "left": "ReportArchive 사용 설명서 · 2026-05-27", "right": "내부 배포용" }
}
