{
  "kicker": "문서의 전체 구성",
  "title": "이 보고서의 구성과 읽는 순서",
  "items": [
    { "no": "1.", "group": "배경과 전제 정리", "text": "플랫폼 도입 배경과 목적 정리", "note": "조직 보고 관행 진단", "page": "3" },
    { "no": "2.", "group": "배경과 전제 정리", "text": "기존 방식의 한계와 비용", "note": "중복 작성 비용 추정", "page": "5" },
    { "no": "3.", "group": "구조와 데이터 흐름", "text": "3계층 시스템 구조 해설", "note": "백엔드·프론트·DB", "page": "8" },
    { "no": "4.", "group": "구조와 데이터 흐름", "text": "보고서 관계 3종 비교표", "note": "Mount / Fork 차이", "page": "11" },
    { "no": "5.", "group": "작성 기능 카탈로그", "text": "위젯 카탈로그 전체 35종", "note": "표·차트·관계도 계열", "page": "14" },
    { "no": "6.", "group": "작성 기능 카탈로그", "text": "혼동하기 쉬운 위젯 쌍", "note": "입력 키 선택 기준", "page": "17" },
    { "no": "7.", "group": "운영 정책과 권한", "text": "권한 역할 모델과 잠금", "note": "RACI 편집 정책표", "page": "19" },
    { "no": "8.", "group": "운영 정책과 권한", "text": "게시판별 편집 정책 운영", "note": "mount 단위 지정법", "page": "21" },
    { "no": "9.", "group": "배포와 향후 계획", "text": "배포 구조와 실행 절차", "note": "SIF 단일 이미지본", "page": "23" },
    { "no": "10.", "group": "배포와 향후 계획", "text": "향후 도입 계획과 일정", "note": "단계별 진척 현황", "page": "26" }
  ],
  "note": "페이지 번호는 인쇄본 기준이며 화면 열람본과 다를 수 있음",
  "page": { "no": "02", "total": "28" },
  "footer": { "left": "ReportArchive 사용 설명서 · 2026-05-27 갱신", "right": "내부 배포 전용" }
}
